956	6 ) Animated history of the US .	Animated	2	0
1679	Do you mind if we check it out anyway ?	mind	2	0
1732	My mind began to dissipate , but then I felt the pain withdraw and a lifeless voice said , This ones blood isnt worth drinking .” Hands closed on my neck and I felt my spine crack .	isnt	22	0
1037	It is not only the highest grossing non-music documentary of all time , among the users of the largest Internet film database , IMDB , it is also the highest rated one .	is	1	0
1148	Ralph , having begun the business of unburdening himself , continued .	unburdening	7	1
1432	He gave me a half-hearted wave that made me wonder what exactly we were chasing , and whether I should be wearing body armor .	wearing	21	0
25	The beys and ayans rose and took their leave silently , glad to be alive and as perplexed as though they had witnessed a conjurer s performance .	perplexed	17	0
562	Luxurious , even compared to the fare one would find in the high-class space stations and pleasure cruisers .	compared	3	0
1132	Its residents are mainly Italian and RomanCatholic , with a small concentration of Methodists on the east side .	are	2	0
305	The event - if it can be called such - has been described , with negligible variations and modifications , by many authors , and I shall keep to the version provided by Chaim Frankel - the advantage of his narrative residing in the fact that it recapitulates the views of other disciples who have written about the Master .	recapitulates	47	0
185	Ningis are not negotiable currency because the Galactibanks refuse to deal in fiddling small change .	refuse	8	0
1801	Unfortunately , their zeal was not matched by their discrimination .	matched	6	0
1572	I mean , we might have a lot of work ahead of us .”Are you kidding ?	have	5	0
527	She gave me a look , pitying and a little pleased that she got to be the one to share the news .	got	13	0
1606	Youre just lucky that Dvorov isnt my only contact .	just	1	0
1558	Here , theyre the snotty rich who show up in clubs because they like the ‘gritty ambience – you have them in your world , too , right ?	have	19	0
1009	If Moore simply chose not to show how he revealed his identification to the salesperson , there is nothing fraudulent about that .	is	17	0
248	Stay tuned for a more in-depth post on the topic .	tuned	1	0
1868	So what he had experienced in the other car , her brother 's car , the night he had returned exhausted and bewildered from his nightmare years in the stars had not been the unbalance of the moment , or , if it had been , he was at least twice as unbalanced now , and quite liable to fall off whatever it is that well-balanced people are supposed to be balancing on . "	balancing	71	0
1586	Do you know what this thing does ?” I shouted , hardly able to hear myself .	know	2	0
884	It tells viewers : Aha , this is the person we are talking about .	is	7	0
629	Relatively says it all .” Zheng scoffed .	says	1	0
822	Dear David Hardy , It is fascinating to watch the organized character assassination of Michael Moore that has been going on in the United States since the release of his last documentary .	going	19	0
56	At the same time the other one also took an involuntary step back as though he were invisibly tied to the first .	tied	18	0
1171	Mahogany-black curly hair , cut short in the typical military style framed a careworn , dark-skinned face .	framed	11	0
1457	Lets go .”As we headed down the sidewalk , I said , What is your name , anyway ?”Thats a question you learn not to ask here .	is	13	0
1389	Their bumpers looked ready to drop off , and their paint was half smog .	looked	2	0
365	There was a lot of trouble with space pirates before they were wiped out in the Dordellis wars , and the megafreighters had to be equipped with the most fantastic defence shields known to Galactic science .	equipped	25	0
459	No sooner had I got there that my former self , the one that operated on my brain , popped into my head and said ‘ Go see Zarniwoop .	operated	14	0
1214	It is in this way that language , properly speaking , is constituted , by a series of analogies that are a lateral extension of the language of action or at least of its vocal element : language resembles this vocal element , and ' it is this resemblance that facilitates the understanding of it .	facilitates	50	0
798	Maybe that made us more real .	made	2	0
1260	It refers not to the end of the world , but rather the end of our current age - Pisces , which began at the time of Christ 's birth , spanned two thousand years , and waned with the passing of the millennium .	spanned	31	0
1423	I dont know how he couldve been heard over the music .”The two glanced at each other .	know	2	0
1544	Thank you for doing business at our house , and I hope to see you again !”I left not a little unnerved , and still woozy from the leeches .	hope	11	0
1235	His own talk , that morning , of needing a favor masked but did not hide that fact .	masked	11	0
1187	It would be a shame to lose that talent , though .	be	2	0
1451	Setting an arm on my shoulder , he said , Nathan , what you see here might be frightening , but those things you saw are people just like you .	are	25	0
958	Of course the cartoon is highly oversimplified , and most critics consider it one of the weakest parts of the film .	is	4	0
375	To Arthur this was exactly what spaceships were traditionally supposed to look like , and to Ford it looked thoroughly antiquated : it confirmed his suspicions that Disaster Area s stuntship had taken them back at least a million , if not two million , years before their own time .	confirmed	23	0
1356	…Sir , if shes in any danger , it will probably be too late to help her by that time .	be	11	0
899	The NRA was fully aware of the scandal it would cause through its rally and decided to push on because they believed to have enough media support to successfully do so .	was	2	0
546	Initially , I could n't figure out why—I had n't requested any be sent .	sent	13	0
784	The stillness of the room contributed , as did the view .	did	8	0
1202	You wanna come over ? "	wanna	1	0
1861	The town seemed mired in a gray and fog-bound hibernation . '	mired	3	0
1369	We have a lot of work ahead of us , and its best to start now .”I walked around the car and got into the passenger seat .	have	1	0
189	Neither could any thing be urged against my father , who , though with some peculiarities , has abilities which Mr Darcy himself need not disdain , and respectability which he will probably never reach . '	disdain	25	0
1716	He bashed up a set of stairs set into the side of the wall , and we chased up after him , heading up a huge staircase that seemed to go up for more stories than the building could have held .	set	4	0
21	The other end of the rope held a suspended ' cello .	suspended	8	0
492	Now , there were two things here that made ridiculously small amounts of sense .	made	8	0
1634	And I am Isis ,” said the woman , offering her hand to me .	am	2	0
1289	use it to sail a mini raft down the slow heavy river Moth ; wet it for use in hand-tohand-combat ; wrap it round your head to ward off noxious fumes or to avoid the gaze of the Ravenous Bugblatter Beast of Traal ( a mindboggingly stupid animal , it assumes that if you ca n't see it , it ca n't see you - daft as a bush , but very ravenous ) ;Arthur woke up and instantly regretted it .	regretted	79	0
1104	The Apathy of USWAUnited Steel Workers of America was the union representing the Youngstown steel workers when the closings hit .	representing	11	0
142	Christian and Islamic Jerusalem For 60 years Jerusalem lay in ruins , until the Roman Emperor Hadrian ordered the city rebuilt as a Roman town dedicated to Jupiter .	lay	8	0
498	Next to those , nothing else mattered .	mattered	6	0
949	These people do not feel the need to express sympathy , or to think about ways to avoid such incidents , but they feel the need to assert their " rights " and to look for quick , simple answers -- as Busch states , gun owners wanted to " hang [the child] from the highest tree " .	feel	4	0
149	She found that the citys most beautiful Roman temple , dedicated to the goddess Aphrodite , stood on the site of the crucifixion .	stood	16	0
682	Repeat it enough times , it 's just a sound .	's	6	0
976	Virtually every child psychologist knows that mother/child bonding is essential for the development of empathy and social abilities , the awareness of the consequences of one 's actions , and the learning of conflict resolution by non-violent means .	knows	4	0
1015	Heston 's answers in the interview were evasive and unhelpful .	were	6	0
944	In any case , at no point does Moore make a false statement , in contradiction to claims by critics that his documentary is " full of lies " .	is	23	0
168	In 1947 the United Nations voted for the partition of Palestine into two states , one Jewish and one Arab , with Jerusalem as an international city that belonged to neither .	belonged	28	0
700	The ship I was on , I guess that 's what happened , too .	's	9	0
94	Da Vinci presided over the Priory between 1510 and 1519 as the brotherhood 's Grand Master , which might help explain your grandfather 's passion for Leonardo 's work .	presided	2	0
1304	But if you ever should see a faerie , tell him that you are of the blood of Ivan Bogatyrivitch and he will not pass you by so quickly . "	are	13	0
1812	In 1566 , they wrested Chios from the Genoese , bolstering their hold on the eastern Aegean Islands , but the Cyclades remained in Venetian hands for another generation or more — Tinos was the last to fall in 1715 .	was	31	0
519	You fit the bill .	fit	1	0
1593	The girl was as soft and rosy as the stones glow , and she was dressed in a white shift tied at the waist with a belt like a Celtic knot .	was	2	0
382	Those advocating nuclear renaissance ignore such aspects of nuclear power at their peril .	advocating	1	0
1532	A marvel , isnt it ?” she said .	isnt	3	0
1718	I called out to Amy to shut the door in case the vampire had any friends who might be trying to follow us .	had	13	0
622	Maybe we had all tired of the frivolity of our life , hitting some threshold or some breaking point .	had	2	0
15	She suddenly broke in again in her other manner , the one he associated with their phone conversation :Herzegovina was pacified .	associated	13	0
1623	I thought that I saw one rib shift in its setting , like a cat trying to scratch its back against a wall , but when I turned , it was still .	was	30	0
1063	Meetings of union officials and mill bosses were hurriedly set up in an attempt to persuadethe powers that be to reconsider their statement .	be	18	0
612	Days passed , weeks passed , but I could n't tell if it had been months or years since I was rescued .	was	20	0
618	( The 'South ' was in the title to suggest that there were more ballrooms .	was	4	0
1842	The sound that accompanied it was the sound of thousands of tense , excited people being completely ignored .	accompanied	3	0
1619	His eyes were white .	were	2	0
1757	However , the result of their arguments is always the same and bespeaks their wisdom : after every conflict , the Greeks and Armenians demand separate temples .	bespeaks	12	0
186	that the unknown author 's name was a nom de plume also irked her .	irked	12	0
229	She said philosophy and epistemology were doing it right : looking at experiences from the inside .	were	5	0
1858	The Holy See will be disassociating itself from you .	disassociating	5	0
981	That 's because while there is a so-called war on drugs , there is no war on poverty .	is	5	0
649	He knows about us .” That 's still dumb ,” said Sarah .	knows	1	0
1605	You idiot ,” he hissed , do you know how much youve set us back ?	know	8	0
97	, Jerusalem was a Canaanite mountain stronghold on a secondary trade route , far less important than biblical cities such as Hazor , Megiddo , Beth Shean , and Shechem .	was	2	0
1876	The fracture he had sensed , the second fracture , lay in the distance before him across the land , the thickness of a single hair across the dreaming landscape of the days of Earth .	sensed	4	0
1228	Each attributed to his opponent strengths and qualities entirely in keeping with the high opinion he had of himself and his task .	attributed	1	0
366	Occasionally Mario would ask for two girls , but the pattern of the calls never varied .	varied	15	0
259	The total number displaced was small .	was	4	0
575	Kishori , petite , her hair strung out in a series of braids that reached nearly to her waist .	strung	6	0
1568	They were spirits of a certain branch of the Volga and the village based around a mill on that tributary .	based	13	0
827	His documentary is full of subtle humor , jaw-dropping dialogue and dark contrasts .	is	2	0
1741	The face , which filled with alarm as he gazed , belonged to the driver of a van which Welch had elected to pass on a sharp bend between two stone walls .	belonged	11	0
1742	The head of this key was not the traditional long-stemmed Christian cross but rather was a SQUARE cross - with four arms of equal length - which predated Christianity by fifteen hundred years .	predated	27	0
1316	Its been over a week , and I want to dance .	want	8	0
353	Now , I 'm not saying the service before my camera-flash was bad , because it was awesome .	was	11	0
266	Zionists argued that the land purchases benefited all the territory 's residents .	benefited	6	0
1723	I could n't tell how many people were running , much less where they were .	were	7	0
244	If there 's nothing you can do , why are you unhappy ? "	's	2	0
1049	The events that would follow this date ( known as Black Monday ) are seen by the people who witnessed them either as stories of great courage and determination or as monuments to human failure and false hope .	seen	14	0
196	( They unloosed her hands ) How I ache to join you both , to slide silently in and join your warmth , to be accepted by her as well as you .	ache	8	0
590	How they were all powered was a mystery—as good as the technology got , a quality robot like that was still an energy sink .	powered	4	0
705	Fact : It 's too easy to fall into patterns .	's	3	0
1108	Thehigher levels of the union became increasingly disassociated with Youngstown and its plight , attempting to shut out theappeals from workers and local union representatives and to ignore what was really happening .	was	29	0
1890	He was most agitated and very eager to tell me something he was sure no one else would credit -- or rather something he had tried to tell repeatedly that no one else believed .	credit	18	0
1408	She came down here with someone after a party , and I dont think it was one of your average pixies .”Bummer .	was	15	0
833	If , as Moore implies ( although never states as fact ) , video games and violent movies are relatively harmless , it does not logically follow that all types of media presentation are harmless .	are	18	0
1676	I bet hes kicking himself now for not having a way to contact me .” In a few minutes , we were back to the first door wed knocked on in this town and Dvorov himself was greeting us .	bet	1	0
119	The Bible tells us that the cruelty and impiety of the rulers of both kingdoms aroused the fury of the great Prophets .	tells	2	0
429	Turning and looking backwards , over the vast two-mile bulk of the ship he could see the far denser mass of stars behind them which seemed to form almost a solid band .	form	27	0
686	We wo n't care that we 're last and we wo n't care that there are no more stars .	care	3	0
1530	Here it is ,” she said .	is	2	0
834	There is a huge difference , for example , between playing a game like " Quake " and listening to a radio broadcast that tells you that your family will be killed unless you take action to kill others now .	is	1	0
1168	Harmon 's face slowly animated - joy sweeping in to replace stern concentration .	's	1	0
1814	The Ottomans brought new influences to the islands that they controlled , forming a large empire that stretched around the eastern Mediterranean .	controlled	10	0
1518	Please , walk this way .”She led us past the silks and through an arch decorated with pictures of wooden ships and what looked like African tribesmen .	looked	23	0
1301	When I asked her if she 'd ever seen them – before I was old enough to stop believing , I mean – she would always look sad and tell me , " No , not since the family came to America has anything happened to us .	look	26	0
1521	After this , we went up a flight of stairs and past a row of doors barred on the outside .	barred	16	0
144	Jerusalems physical existence as a spiritual city seemed finished , but its spiritual power for Jews , and for the struggling new Christian religion , remained .	seemed	7	0
1875	This large , discordant but connected family was setting off into complete uncertainty , and it was creaking in all its joints .	creaking	17	0
1030	It is not a flawless diamond -- the " 48 hours " scene in particular suffers from bad editing , the statistics are suboptimal , and Heston gets a bit more bashing than he deserves .	are	22	0
843	Children who grow up in war-torn regions are known for having similar views -- war is perceived as a normal part of existence , violence as a natural way to solve disputes .	known	8	0
40	This job had kept her grounded during the seven years she had overseen Jack 's healthcare .	overseen	12	0
1525	As she brought out the key , she said , We deal mostly in fairly mundane trades , but there are a few customers with more unusual needs and people willing to sell unusual items .	are	20	0
125	When Seleucid rulers outlawed Judaism , Jews led by Judah Maccabee and his brothers staged a revolution in 167 b .c .	led	7	0
1357	My girlfriend has disappeared , I dont even know where to start looking , and I need help !	know	8	0
563	Compared to what a mere engineer would get on your typical cargo ship , it was mouthwateringly , lip-smackingly gorgeous .	was	15	0
560	The plate , by the way , was already loaded with folded pieces of smoked pink fish , paprika-dusted deviled eggs , toothpicks stabbed through green vegetables and slices of cheese , and balls of meat smothered in a tomato-based sauce .	loaded	9	0
1715	He bashed up a set of stairs set into the side of the wall , and we chased up after him , heading up a huge staircase that seemed to go up for more stories than the building could have held .	held	40	0
340	There 's nothing wrong with it : the food in those jars is probably delicious , though I question whether the $10 tupelo honey had to come from Florida or if it 's produced locally .	had	24	0
1142	For the people of Youngstown , Black Monday was not just a historical event-it was the most important event in their lives .	was	8	0
947	After the Flint rally comes a brief TV interview with Heston , where he is asked about Kayla Rolland ( again , clear evidence that the local media in Flint raised questions about the NRA 's presence ) , then an inteview with country prosecutor Arthur Busch , entirely ignored by critics of the film , who also mentions Heston 's presence as notable , and refers to the immediate reactions of " people from all over America " , gun owners/groups who , according to him , reacted aggressively to warnings of having guns accessible to children , much like spanking advocates react aggressively when anti-spankers point to a case of a child being killed or severely injured by a beating .	is	14	0
300	”He hurried after her , mesmerized by her supple gait .	mesmerized	5	0
1165	As the street was narrow and the upper storeys of the houses jutted out on both sides , the procession was riding between two rows of insults and threats .	jutted	12	0
1449	Those of us who live permanently in this world tend to set up in places like this , where the human population is so overwhelming that they wont be noticed in the right corner , with the right protective spells .”He took out the hunchbacks directions and glanced at an alley behind us .	tend	9	0
1064	However , it was clear that , in the words of USWA president LloydMcBride , If you cant make a buck , you get out of the business .”The closings meant the end of Youngstowns only real industry , the end of its population growth , and then end ofeconomic progress .	meant	30	0
1629	As she rose , her robes fell open and I realized that , except for what looked like a red silk kimono , she was naked – naked and stunning .	was	24	0
17	but I admit the novel currently lags behind probable reality .	lags	6	0
1184	There had to be more to her .	had	1	0
270	Israel confiscated all land owned by the British government , mostly desert and mountains , after the 1948 War of Independence .	owned	4	0
302	Beyle , then working on his history of Italian painting , had been told it was by Guercino , whom he ‘ worshipped from the bottom of my heart ;That 's muddled me . "	worshipped	22	0
1747	It depends what transpires from the meeting , ” said Zarniwoop .	depends	1	0
415	I was compelled , " said Arthur , " to ignore it . "	compelled	2	0
1077	Foreign steel was easier and more efficient to make , and was often of higher quality than domestic steel .	was	2	0
1524	The woman paused before another door , this one not barred but locked .	barred	10	0
1155	Here is Grandpa astride a motorbike in 1912 , with Grandma perched on the back ; " Who are you that go prowling about at this hour of the night ? "	perched	11	0
1889	” " Signora Silvestri from downstairs brought it up when she heard I was hosting newly weds here . "	hosting	14	0
384	Death and dying generate a whole questionnaire of such would-you-rathers .	generate	3	0
46	I had hoped that our sentiments coincided in every particular , but I must so far differ from you as to think our two youngest daughters uncommonly foolish . '	coincided	6	0
533	I mean , sure , I 'd had my moment of elation when I had first realized I 'd been rescued , but it did n't sink in .	mean	1	0
1122	Youngstown is thename of the major city area , but surrounding it on all sides are small communities which to the casual viewer areindistinguishable from the main city itself .	is	1	0
1194	His silken fur , which would be tawny golden and striped with jet black bands , was dyed perfectly to a pure black , and his mane trimmed and thinned as to be indistinguishable from the rest of his coat .	dyed	17	0
344	Either way , it 's nice to see a restaurant built on ethics that also happens to be incredibly busy .	built	10	0
1410	Thats why we came here .”It was easier to talk than to question .	was	6	0
1405	When he grinned , I saw that his teeth were sharp and small , like a hunting cats .	were	9	0
1302	When I asked her if she 'd ever seen them – before I was old enough to stop believing , I mean – she would always look sad and tell me , " No , not since the family came to America has anything happened to us .	was	13	0
1048	The events that would follow this date ( known as Black Monday ) are seen by the people who witnessed them either as stories of great courage and determination or as monuments to human failure and false hope .	known	8	0
1832	Politically , the 1990s have been relatively quite times for the islands , although the divorce of Greek prime minister Andreas Papandreou and his subsequent marriage to a much younger woman caused consternation within conservative Greek society .	been	5	0
77	By all means view your own feelings dispassionately , if you feel you ought to , but that 's nothing to do with deciding whether ( Christ ) you 're in love .	view	3	0
1190	Only those of the Arrallin Insurrection inner team knew he was no common 'beta furry ' .	was	10	0
14	Perpetual darkness reigned there and no one entered save with a lantern .	reigned	2	0
1476	We have many fine cloves of garlic here on the cart , gentle sir .	have	1	0
1841	In which tree they are born , live , fall in love , carve tiny speculative articles in the bark on the meaning of life , the futility of death and the importance of birth control , fight a few extremely minor wars , and eventually die strapped to the underside of some of the less accessible outer branches . "	strapped	47	0
814	The last thing I remember , I was tearing down the corridors .	remember	4	0
1791	Several islands and Greek city-states agreed to work together , and created a treasury to fund their plans , which was held on the island of Delos .	held	21	0
626	Impossible ,” said Zheng , sitting in the chair to her left .	sitting	5	0
47	He didn t need to do this since his body was supplied with the peculiar assortment of gases it required for survival from a small intravenous device strapped to his leg .	required	19	0
1835	Whether this will ever happen remains to be seen , but perhaps the aid offered by Greece to Turkey after 1999s devastating earthquake is a sign that the animosity between these two traditional enemies is beginning to diminish .	remains	5	0
632	We 'd just appear to age slower than people not traveling as fast as us .” And ?” said Sarah .	appear	3	0
1141	But to the thousands of people living there , the loss of the mills was a devastating event that sent shock wavesthrough their economic , political , and social futures .	living	6	0
73	Furthermore , the law states that Election by Adoration supercedes the cardinal eligibility requirement and permits ANY clergyman - ordained priest , bishop , or cardinal - to be elected .	ordained	19	0
280	But that decree did not have the power of civil law behind it .	have	5	0
385	the chain end of the rope coils in my lap .	coils	6	0
1602	Get out of my sight now – unless you know how to put it back ?	know	9	0
180	But the ideas and mystique that have always made this an extraordinarily special place rise above the ebbing and flowing concerns of present-day Jerusalem as it continues to tug at the worlds attention into the new millennium .	rise	14	0
20	When they arrived home , he headed for his den where Marian saw to it that the bar was kept well stocked with his favorite brands .	stocked	21	0
1615	Amy liked it , I think .	liked	1	0
