956	6 ) Animated history of the US .	Animated	2	0
39	If Arthur Dent had been within five miles of the speaker silos then his expiring thought would have been that in both size and shape the sound rig closely resembled Manhattan .	resembled	29	0
1844	Villon imbibes that sound ! "	imbibes	1	0
825	Moore portrays the NRA as an unethical , dishonest organization ; he sees the paranoia and fear in the United States as a primary cause of violence , and he does not see gun ownership itself as a problem .	see	32	0
416	Shuddering in his efforts to repress a yawn of nervousness , he asked in his flat northern voice :Speaking of my old friend and biographer , I would take this opportunity to remark that if I burden myself with a companion in my various little inquiries it is not done out of sentiment or caprice , but it is that Watson has some remarkable characteristics of his own to which in his modesty he has given small attention amid his exaggerated estimates of my own performances .	burden	36	0
326	When I 'd posted on Facebook that I was coming to town , no fewer than three people told me I just had to visit the Tupelo Honey Cafe .	had	22	0
977	Virtually every child psychologist knows that mother/child bonding is essential for the development of empathy and social abilities , the awareness of the consequences of one 's actions , and the learning of conflict resolution by non-violent means .	is	8	0
1487	Theres an entire industry in my world based around how unkillable they are .	are	12	0
152	The Temple Mount was identified in Islamic tradition as the farthest spot” ( in Arabic , el-aksa ) , the site to which the Prophet Muhammad was transported in one night from Mecca on a winged horse , as described in the 17th chapter of the Koran .	described	39	0
57	Miss Bingley was then sorry that she had proposed the delay , for her jealousy and dislike of one sister much exceeded her affection for the other .	exceeded	21	0
1086	Since this problem was a national one rather than a local one , the problems that were occurring in Youngstown werenot unique .	were	16	0
1067	The workers decided they needed to do something to save their city , and so theymobilized in a variety of ways .	needed	4	0
321	Well , Signora Toffana sympathised with those poor women and sold them some liquid in a bladder .	sympathised	4	0
892	This is a common technique , but because conservative readers are not familiar with the basics of filmmaking , they believe critics who claim that he is " distorting " the interview .	are	10	0
2	And it stuck up curiously on his head as though someone else 's hand had placed it , in the dark , on a corpse which would never again adjust or remove it , for it was destined to be buried and rot with him .	destined	37	0
988	How could he even think about blaming poverty and forced labor programs for anything bad that happens ?	think	4	0
1470	Its arms were thin and long enough to reach any herbs from its cushion in the center of the cart , and with its long , many-shouldered pole of a torso , it rose over our heads even while seated .	rose	33	0
348	The potatoes were light and un-greasy ; the flavors were perfectly balanced ; the chicken was juicy and rich ; and let 's be honest here , I 'm always happier eating dead animals when I know they 've lived a good life .	know	36	0
74	Part of his brain told him that he knew perfectly well what he was looking at and what the shapes represented whilst another quite sensibly refused to countenance the idea and abdicated responsibility for any further thinking in that direction .	countenance	27	0
400	After each significant snowfall , people would shovel the snow off their cars that were parked on the street , and then they figured that their effort had earned them ownership rights over that little piece of street .	figured	23	0
133	The courtyard around the Temple was expanded to accommodate hundreds of thousands of pilgrims , and the Temple Mount was shored up by retaining walls made with great stone blocks .	made	25	0
367	Nor did his stutter hinder him in this , for when whispering with his coreligionist in misfortune he forgot to stutter .	hinder	4	0
926	This is naive to the extreme -- Heston would not be president of the NRA if he was not kept up to date on the most prominent cases of gun violence .	kept	19	0
49	As to his physical appearance , suffice it to say that Doyle was man enough for the tasks he set himself , sturdy , athletic , without vanity but not above a conditioned twinge of shame if he encountered social betters while wearing cuff or collar frayed by his financial limits .	suffice	6	0
432	The reason why it was published in the form of a micro sub meson electronic component is that if it were printed in normal book form , an interstellar hitch hiker would require several inconveniently large buildings to carry it around in .	published	5	0
1493	As you can see , our situation is of personal importance to the young man .	is	7	0
381	”By a curious coincidence the resulting word perfectly expressed the way Arthur was feeling about things just then .	expressed	8	0
1411	I …I noticed him from across the room when I was looking around for Rachel .	was	10	0
603	I would attend afternoon dance classes , so that when the evening dances came around ( modeled after the historical social gatherings of several hundred years prior ) , I would be less of an embarrassment to myself .	be	31	0
6	But four hours later the fish was still swimming steadily out to sea , towing the skiff , and the old man was still braced solidly with the line across his back .	towing	14	1
1133	Unemployment is low in comparison with surroundingtowns , and the streets are clean and well kept .	are	11	0
1860	According to this interpretation ( and that too was not his own , for he had found it in the good old books inherited from his one-time teacher , the famous Araphodza ) those now known as anarchists had always existed and would always exist while the world lasted .	inherited	23	0
1163	The inner struggle that preceded this signature was so great that Daville felt that his name was not lost among the other 20 , 000 names , for the most part weightier and better-known than his , but written in letters of fire across the evening sky over Paris .	preceded	4	0
1418	I get that all the time around here .”He was wearing a sort of jacket …maybe blue velvet , I could n't tell in the dark , but it had ruffles at the throat , things like that .	had	29	0
311	Oh , ” said Arthur brightly , you mean we ve travelled in time but not in space .	mean	8	0
1763	That is to say , the thing that surprised him was not that he could see , but what he could see .	surprised	8	1
630	Even if we were traveling at ninety-nine percent of the speed of light—that 's assuming you ignore science and pretend that such a thing is possible , because it is n't—we 'd still age .	pretend	19	0
1367	You dont look dressed for this weather .”I glanced back over my shoulder .	look	2	0
812	I did n't want to forget .	want	3	0
1807	The minor Aegean Islands were taken by various powerful European noblemen , many of whom were Genoese or Venetian , such as Marco Sanudo on Naxos .	were	4	0
1196	His eyes had been treated and darkened to a rich purple to disguise the brilliant golden yellow color that would mark him as an Alpha Arrallin , and leader of his hive .	mark	20	0
350	The potatoes were light and un-greasy ; the flavors were perfectly balanced ; the chicken was juicy and rich ; and let 's be honest here , I 'm always happier eating dead animals when I know they 've lived a good life .	was	15	0
1795	Cleopatra was a member of this famous ruling clan .	was	1	0
1478	If – ”You know what I mean .	mean	6	0
1822	Thousands of people arrived with little more than the clothes they wore , putting great strain on the resources of the islands .	wore	11	0
1394	Someone standing just in the lip of an alley glared at me with gleaming eyes .	standing	1	0
600	Fact : It 's easy to fall into patterns .	's	3	0
1490	Theyre almost as rare here , and Ive never heard a reliable story of someone successfully fighting a vampire .”Only unsuccessfully , right ?”No , those people dont usually leave stories .”Oh , thanks , Nepthys , for your confidence-inspiring tales of experience .	almost	1	0
1894	A point occurred to him about this .	occurred	2	0
895	The same goes for the interview which follows .	goes	2	0
702	It was all so fast .” She took a sip of her drink , plain water because , she had explained earlier , she had never liked the taste of alcohol , then fixed her gaze on me .	liked	26	0
942	The somewhat inept editing of the NRA press release has led some viewers to wrong conclusions , which is unfortunate , but Moore 's critics have no interest in viewing the matter fairly .	have	25	0
845	In a weaker sense , the same message is projected to American children , who grow up being told that it is not acceptable to be violent to one another , but who simultaneously have to endure corporal punishment and media messages about how " the enemies of freedom " are punished .	have	34	0
1654	I think that the person who stole the girl were looking for might be a vampire .	be	13	0
838	Moore 's hypothesis ( which apparently comes at least in part from the book " Culture of Fear " by Barry Glassner , also advertised on Moore 's website ) is that the constant bombardment with messages of fear can incite paranoia , which itself can lead to violent acts .	is	30	0
907	It is probably correct that their primary reason for not doing so was to save money , not to piss off the victims of Colubmine .	is	1	0
1857	Everything was permeated and connected with innumerable regulations , traditions and customs , everything was communal and everything thought out , constant , unchangeable and enduring .	permeated	2	0
1672	I found your vampire ,” she said , but he might know that someones looking for him .	know	11	0
13	Papal law prohibits autopsy .	prohibits	2	0
967	The kid was a little bastard , and the parents were involved in drugs -- case closed .	was	2	0
1205	While Mrs Vaughn had once epitomized furtiveness by her hesitant and darting movements in the driveway - both on her way to model and on her way back to her car - she now approached every new opportunity to pose with the resignation of a dog submitting to a beating .	epitomized	5	0
494	Second , I was floating in the dark remnants of my broken ship , and any conceivable light sources were not within view ; starlight is a distinctly different color and significantly less bright .	is	25	0
1607	Walking outside , I was shocked to see that it was already dark .	shocked	5	0
363	However noncommittally Arthur grunted , the man seemed determined to talk to him .	determined	8	0
247	All the methods built off the idea that you are in control : anger is an emotion , and you can change your emotions .	built	3	0
881	It is typical for his critics to jump on what is at most a slightly misleading implication , but in doing so , they themselves have , unlike Moore , made many incorrect claims .	have	25	0
1217	At first it was just a vague general mood , manifested only in brief gestures and curses with everyone knowing whom they referred to .	manifested	10	0
1758	He also appeared to be playing with a rubber duck .	appeared	2	0
267	Zionists also maintain that Jews became a lucrative market for Arab-manufactured goods .	maintain	2	0
191	In turn , this sense of fairness is coupled with moralistic aggressiveness when cheating tendencies are discovered in a friend . "	coupled	8	0
252	A person is never " done , " and so , I 'll continue to observe and discuss and study , trying to pick the directions in which I 'll change , and trying to make tomorrow better than today .	done	5	0
920	He certainly does not " attribute it to a speech where it was not uttered " and , as noted above , doing so twice would make no sense whatsoever if Moore was the mastermind deceiver that his critics claim he is .	make	26	0
1738	Rachel , her clothes torn and her face drawn , looked like she might cry when she saw me .	looked	10	0
1539	Remember , this is your quest .	is	3	0
1577	As long as I looked at it , it didnt reveal any magic sparkle or glow .	looked	4	0
581	Tonight was for observation .	was	1	0
65	Miss Bennet was therefore established as a sweet girl , and their brother felt authorised by such commendation to think of her as he chuse .	authorised	14	1
1002	The gun homicide rates for the countries Moore mentioned , according to guncite , are : Japan : 0 .02 per 100 ,000 ( 1994 ) England/Wales : 0 .11 per 100 ,000 ( 1997 ) Germany : 0 .22 per 100 ,000 ( 1994 ) Australia : 0 .44 per 100 ,000 ( 1994 ) United States : 3 .72 per 100 ,000 ( 1999 ) Critics fail to credit Moore with not making the same mistake that some gun control advocates make -- concluding that gun ownership " leads " to violence .	are	14	0
1488	Are …look , are they as bad as people in my world think they are ?”I dont know .	know	17	0
1343	I called Mitch and our other friends , hoping that shed crashed at one of their houses , but I had no luck .	hoping	8	0
1267	As one of the Galaxy s most prominent and successful psychiatrists , he and a consortium of his colleagues were quite prepared to spend an awful lot of money when it seemed that the entire future of psychiatry might be at stake .	spend	23	1
79	the novelist now wondered - for although she 'd always claimed that a good writer could imagine anything ( and imagine it truly ) , and although she 'd often argued that real-life experience was overvalued , even Ruth was surprised by how accurately she 'd imagined being a widow .	overvalued	35	0
482	This is more than the person would have sans space suit .	is	1	0
828	All in all , it is an accurate portrayal of America 's gun and violence culture .	is	5	0
208	These soldiers know what they want to do , they have a mission and a course , they are within their natural environment , however much they may resent it , however they may yearn for resumed civilian roles .	yearn	34	0
1804	While Byzantine land was being divided , there was no one in control of the seas , so pirates raided towns on many of the islands .	was	3	0
1713	In a blink of the strobe light , he was on his feet and dashing from the room .	was	9	0
177	Within three days the city was completely in Israeli hands , and in two weeks it was physically and administratively reunited .	was	5	0
582	I did n't bother trying to seek out a different group of potentially more interesting people , though .	bother	3	0
1680	I have a real feeling that hes in here somewhere .”Dvorov glanced over his shoulder , a little nervous .	have	1	0
1017	While this can in part be explained with his age and mental condition , if he is unable to defend the interests of the NRA , he should not be their spokesman .	be	5	0
534	I mean , sure , I 'd had my moment of elation when I had first realized I 'd been rescued , but it did n't sink in .	had	7	0
1464	The sky , cupping over squat buildings , was less yellow here , and stands were set up everywhere the way Id picture a market in the Middle East .	was	8	0
1647	She has good blood under her cheeks .	has	1	0
1516	I am Madame Entera , at your service .	am	1	0
842	Moore 's second hypothesis is that America 's foreign policy may contribute to the belief that violence is an appropriate means to solve conflicts , a hypothesis which is shared by many sociologists and psychologists .	is	4	0
1508	Nepthys didnt need to warn me not to speak to them .	need	2	0
769	I was just coming up on a corner and he was around the other side , talking to a couple people , and they must not have known I was there .	was	1	0
1600	I thought back to one time when Id been thinking about raising a family and remembered that Id always liked the name –Amy .”Nepthys looked at me incredulously .	liked	19	0
815	Life boats , I thought .	thought	4	0
1321	It was dark enough that I could actually see a few stars through the screen of city light .	was	1	0
169	But lacking the means to enforce its decision , the United Nations was powerless to halt the fighting that erupted as the British withdrew their troops in 1948 .	was	12	0
615	Gathering for drinks in the parlors , playing dress up with all the fine clothes I found in the closets ( some of it modern , some of it period dress for special themed events ) , idling in the lounges .	themed	33	0
668	You never know when it will end ,” Ray continued , not addressing any one of us in particular .	know	2	0
608	But I was n't sure I wanted the dream stage to end .	was	2	0
770	I was just coming up on a corner and he was around the other side , talking to a couple people , and they must not have known I was there .	known	27	0
210	For indeed , a man who aspires to rise above the mediocre , to be something more than ordinary , surely deserves admiration , even if in the end he fails and loses a fortune on account of his ambitions .	aspires	6	0
1366	Really , Id like to help .	like	3	0
160	The Holy City remained a backwater until the 19th century , when renewed interest among Christian pilgrims made it the destination of thousands of travelers each year .	remained	3	0
1312	He says we should meet him tonight , theres a good one going on in that church that closed down last month .”I dont know … it was going to be just us tonight .	know	24	0
624	Captain 's cohort , she had a glass of orange-brown liquid in one hand ; it might have been orange juice and some kind of berry liquor .	been	18	0
98	The earliest name associated with the city , Ur usalim , perhaps meant city of Shalim” or founded by Shalim .	meant	12	0
970	It is by now well documented that the CIA tolerated crack sales in US cities to fund the operation of South American " contras " It is equally well known that the so-called " war on drugs " begun under the Nixon administration is a failure which has cost hundreds of billions and made America the world leader in prison population ( both in relative and absolute numbers ) .	is	1	0
1099	People clung to vague ideas of worker collectivization , but no one could really fathom exactly how that wouldwork ; the people of Youngstown were , after all , not particularly familiar with socialism or collectivization in general .	were	24	0
1728	The stake went down , there was a blur , and then my hands were empty and I felt pain under my jaw .	were	14	0
1257	Well , you might think , that s professional philosophers for you : too busy theorizing in the abstract to notice what station they re at , let alone what s going on in the non-abstract world the rest of us inhabit .	inhabit	41	0
1255	With her heightened awareness of how much she loved her only child , Ruth found herself sympathizing with Marion 's efforts not to love another child - since Marion had already lost two . "	sympathizing	16	0
364	To those who said that they had a feeling soap wasn t found in mines , the Captain had ventured to suggest that perhaps that was because no one had looked hard enough , and this possibility had been reluctantly acknowledged .	acknowledged	40	0
888	The " visual of a billboard and a narration " is viewed by you as evidence that Moore is trying to somehow tie the two events together , when in reality , it is quite obvious that he does it to separate the introduction of Heston from his speech in Denver .	does	38	1
1285	It sounds a terribly interesting project .	sounds	1	0
638	So what 's our cargo , eh , captain ?” Zheng joked , leaning back in his chair with his glass of wine .	's	2	0
1474	Would the gentlemen care to purchase some fine herbs ?” it asked .	care	3	0
706	I resolved to break the pattern .	resolved	1	1
1686	I guess I probably shouldve known , though .	known	5	0
10	She was at least free from the offence of Mr Darcy 's further notice ; though often standing within a very short distance of her , quite disengaged , he never came near enough to speak .	disengaged	27	0
509	I was one more scrap to weld onto the rest , one more stranded survivor who was found .	was	1	0
1040	It is unlikely , however , that the unfair attacks against him will have much of an impact .	is	1	0
1837	I have even stressed the other fact that everything which man by tradition venerates and reveres , does not represent an absolute ethical value , but is sacred only within the frame of reference of one particular culture .	venerates	13	0
374	I only flower in the Paris flowerpot , everywhere else my roots rot , R-r-règne !	flower	2	0
1299	To the right loomed the Palace of the Tribunal , the lush papal residence rivaled only by Versailles in its baroque embellishment .	rivaled	14	0
256	A second wave of 30 ,000 immigrants came between 1905 and 1914 , many of whom were Labor Zionists who wanted the Jewish state to be socialist .	wanted	20	0
1694	Somewhere toward the center of the dance floor , I heard a howl that sent bitter winds under my clothing – for a second , I was back with my family in Russia , hiding from the cold .	was	26	0
1556	You figure theyre some Lincoln-green pretty boys who run around in the forest with bows and live forever in halls of glory , right ?	live	16	0
772	And listen , when they came round the corner , Ray was with the captain .” The next time the captain stopped by our group , Tiffany tagging along ( pretending that she , too , was a social butterfly who could mingle equally well with everyone ) , we were ready .	were	50	0
408	In a moment he said , without quite succeeding in keeping the plangency out of his voice :For the moment society seems keen to bind itself against such temptations , to place a moratorium on cloning or germline gene therapy and strict limits on embryonic research , to forego the medical possibilities in exchange for not risking the horrors of the unknown .	succeeding	8	0
1070	The International chapter of the USWA had much more lobbying power , but they refused to support the local unionmembers .	had	6	0
1311	Her head tilted into the phone as she listened , her pleather purse on her lap , shining jet against the worn black of her snug Dead Can Dance T-shirt .	tilted	2	0
910	This is what good documentary filmmaking is about .	is	1	0
7	WHAT DATA DO YOU REQUIRE ? '	REQUIRE	4	0
1659	I thought back to seeing the man in the hollow church and described his skin , his dark hair , the way that light seemed to flow around him , as best as I could .	seemed	24	0
457	Then he tried to quieten Ernest Straw down himself and succeeded to the extent that the furious accountant stopped raving and advanced to the point where his nerves brought on fits of crying .	raving	19	0
1149	The metal was so hot it nearly blistered their fingers , but he weighed surprisingly little , and hung limply between their arms .	weighed	13	0
1691	Good luck .”Something with too many arms was manning the turntables above the crowd , which looked more impenetrable tonight than ever before .	manning	8	0
1156	The most gifted amongst them despised all that they should have learnt and underestimated all that they were able to do , but they boasted of what they did not know and waxed enthusiastic at what was beyond their powers to achieve .	underestimated	13	0
773	I 've been having headaches .” It was a lie , but we needed information .	needed	13	0
63	On prehistoric Earth he had lived in a cave , not a nice cave , a lousy cave , but . . .Denise closed her eyes , but this substantially worsened the phase-sync problem .	lived	5	0
296	He loathed the foreign Christian power and all that it would bring with it as much as the mufti or any of the insurgents .	loathed	1	0
352	On another topic , I made a discovery there in the Tupelo Honey Cafe , one which I 'd like to share with you now .	like	19	0
938	The camera lingers on Bush/Cheney posters , and the protestor is quoted as saying that " we wanted to let the NRA know that we have n't forgotten about Kayla Rolland " .	wanted	17	0
556	We did n't pick up many passengers—just the select , special few , scattered here and there between the stars .	scattered	13	0
1238	said Bilbo , not daring to disagree , and nearly bursting his brain to think of riddles that could save him from being eaten .	disagree	6	0
1237	Great Grandfather , ” he said , It applies to us !	applies	8	0
1751	Now who do you think wields the most influence , Sgt .	wields	5	0
870	What 's the difference between that mass destruction and the mass destruction over at Columbine High School ? "	's	1	0
478	I swore , if I ever had to see a photo of him in a skimpy bathing suit again , giving the camera a cheesy thumbs-up from a lounge chair on one of those white sandy beaches , I 'd kiss a monkey .	had	6	0
1643	Does it have anything to do with why your head is shaved ?”It was part of the price for this girl , who was a rock at the time ,” explained Nepthys .	have	2	0
836	Similarly , the main motivation for the crusades ( beyond the promise of wealth ) was that Christians were supposedly being slaughtered and had to be saved .	was	15	0
790	Thinking about that , I wondered if Sarah 's theory was right after all .	was	10	0
1022	Conclusion You write : " Bowling for Columbine is dishonest .	is	8	0
1128	For example , Struthers is a poor town with a largeSlovak population , where education is generally better than in surrounding towns , but unemployment is much higher andpollution is widespread .	is	4	0
805	Our instinct was to hide .	was	2	0
378	This was exactly what no one would have expected , and of course – villains were not announced with hisses or soliloquies , they did not come cloaked in black , with ugly expressions .	cloaked	27	0
124	, but much of the city still lay in ruins .	lay	7	0
645	The universe as we know it wo n't be the same .” That 's dumb ,” said Sarah .	know	4	0
1213	Perhaps because their history shames them ?	shames	4	0
399	This should be emphasized because , as had already been revealed , they escape otherwise completely unharmed and the deadly nuclear missiles do not eventually hit the ship .	emphasized	3	0
