956	6 ) Animated history of the US .	Animated	2	0
444	Is it a sign of the approaching birth , or , even less than that , of the very first glow , low in the sky , of a day scarcely even heralded as yet , but in which we can already divine that thought - the thought that has been speaking for thousands of years without knowing what speaking is or even that it is speaking - is about to re-apprehend itself in its entirety , and to illumine itself once more in the lightning flash of being ?	divine	42	0
1039	His next project has the working title " Fahrenheit 9/11 : The temperature at which freedom burns " , and he intends to launch it shortly before the next US presidential election .	has	3	0
500	The recycled air tasted sweet in my mouth , and all thoughts that crossed my mind were cheap metaphors about life-giving substances and how breathing was like sex , only better .	tasted	3	0
1236	This gave the foreigners a chance to see what health and sickness meant to these people and what being ill in this country entailed .	entailed	23	0
810	I 've got a replacement lined up .” I ran .	lined	5	0
1370	Before I had my belt on , we were rolling forward .	had	2	0
452	Both are deceased . "	deceased	2	0
1195	His silken fur , which would be tawny golden and striped with jet black bands , was dyed perfectly to a pure black , and his mane trimmed and thinned as to be indistinguishable from the rest of his coat .	trimmed	27	0
489	It was a fine bell , reminiscent of ancient stone churches and the towering cathedrals I 'd seen in documentaries .	was	1	0
713	But we see new faces .” You 're sure it 's not just some people being indisposed ?	sure	8	0
1183	She seemed so depthless - self conscious and shallow on the outside , but having that incredible gift .	having	14	0
896	Moore 's critics would expect us to have him quote Heston in his entirety , have him present fully the PR that the NRA has used to justify its rally in Denver for reasons of " balance " .	expect	4	0
667	We are n't special .” Again , bleak ,” commented Zheng .	are	1	0
535	After watching my ship tear apart , after spending a good twenty-three hours floating in silence in the wreck , wondering whether I was currently facing stars belonging to the constellation Libra or the constellation Orion when those stars were viewed from Earth , wondering what it felt like to suffocate , and after the feeling that yes , I was in fact going to die alone in space had sunk in , it took time for that feeling to dissipate .	took	74	0
1609	You look ridiculous with a shaved head .” At a nearby stand , he grabbed the first hat that would cover my head and might pass back in real Boston .	look	1	0
1601	So …back to our garlicky friend ?”I suppose so ,” said Nepthys , and youd better pray to whatever god you think will listen that he wont care we woke her up .”We walked back to the herb stand .	care	27	0
1471	Its arms were thin and long enough to reach any herbs from its cushion in the center of the cart , and with its long , many-shouldered pole of a torso , it rose over our heads even while seated .	seated	39	0
245	All the methods built off the idea that you are in control : anger is an emotion , and you can change your emotions .	are	9	0
477	Such a relief to never again hear my crewmate Jesse natter about his girl back on Earth and that all-expenses-paid vacation-for-two she won last time he was on leave .	was	26	0
890	Moore is a professional filmmaker -- he concentrates on maximum impact of each of the statements he cites , and to accomplish that effect , uses subtle interludes instead of long-winded introductions .	is	1	0
268	Jewish land purchases were not the primary factor , these historians say .	were	3	0
86	I believe the fates of men are bonded one to the Other by the cement of wisdom .	bonded	7	0
859	In an interview with the Wall Street Journal , linked from your site , an employee claims that the gun would have been " normally " picked up at another dealer .	been	22	0
1232	And the best actors and singers and dancers of the Opera were there to embellish the dinner parties . "	embellish	14	0
473	>Hotel California Fact : Sound is a vibration .	is	5	0
1775	You will find original examples in the archaeological museums throughout the Cyclades , although one of the earliest examples is in the museum on Paros .	is	19	0
488	Twenty-four hours of silence ( vacuum , remember ) ; was I hallucinating noises now ?	was	10	0
606	Bereft of my previous familiar life , I latched onto Kishori and Ray and Zheng , and Sarah with Alexis dragged along on her arm now and then ( he was mostly her favorite dancing partner ; she confided to us one night that his conversational skills left something to be desired ) .	was	30	0
1677	You got the sucker already ?”No , but we got a tip that he might be in your club .	be	15	0
1025	What is true is that Bowling for Columbine is a diamond in the small world of big screen documentaries , one that shines brightly and illuminates an often misunderstood aspect of American culture .	shines	22	0
883	It is perhaps one of his most famous quotes , shown on national TV even here in Germany .	is	1	0
11	He was much more intrigued by his memory of women whose erotic initiative was muffled and whose appearance was unremarkable ; those whom he tended to underrate .	underrate	26	0
409	Here they had discarded their oxygen gear , and revelled in the strange luxury of being able to breathe without mechanical aids .	revelled	9	0
346	Some of that is surely due to good marketing , but the real reason for its popularity is this : That sandwich was so good , I found myself eating slower and slower with each bite to savor it more completely .	was	22	0
437	So why do you think that homosexual prostitution was such a problem under Theodosius , when both heterosexual and homosexual prostitution had been practiced fairly openly in the Empire up until then ? "	practiced	23	0
387	It s printed in the Earthman s brainwave patterns , ” continued Marvin , but I don t suppose you ll be very interested in knowing that .	suppose	18	0
1429	It wont be long before nightfall .”Oh yeah , man .	be	2	0
678	I wanted to ask , but he was still talking , and I was too self-conscious to interrupt .	wanted	1	0
525	It 's not far ; you 're not going to get blisters .” No , I meant , where 's the ship going ?	's	1	0
417	As if searching for a text he examined her face , noting the tufts of brown hair that overhung the ear-pieces of her glasses , the crease running up the near cheek and approaching closer than before to the eye-socket ( or was he imagining that ?	overhung	18	0
282	Jehu then rode to Jezreel where the old queen-mother , Jezebel , was residing .	residing	13	0
1437	The yellow of this sky wasnt just smog : it had a leeching , heavy dimness .	had	10	0
1182	She seemed so depthless - self conscious and shallow on the outside , but having that incredible gift .	seemed	1	0
172	West Jerusalem , separated from the rest of the new Jewish nation , held out under siege for several months until Israeli forces secured a land corridor connecting the city to the coastal areas .	connecting	27	0
1878	Our external walls are shielded electronically to protect our internal communications .	shielded	4	0
648	He has inside intelligence—how else would he know where to find us ?	has	1	0
1055	Youngstown also was a major railwaycrossroads , due to its strategic position between Cleveland , Pittsburgh , New York , and Chicago .	was	2	0
1665	I hope that you can do a better job than the last lot .” She sat up , running her hands along her pale , round thighs .	hope	1	0
1695	It slumped to the floor and I realized that it was a werewolf .	was	10	0
1320	Come on , I dont have to get fucked up every time we go out just to enjoy myself .	have	5	0
436	He did not polemicize with the dominant movement of the day , Symbolism , but merely dissociated himself from it .	polemicize	3	0
216	Take it through analysis , if there is some benefit in it for you . "	is	7	0
637	Zheng looked skeptical .	looked	1	0
277	However , even these revisionists agree that the Jews had not intended to evict Muslims from Palestine .	intended	11	0
1547	I mean , what is this place , really ?”He thought about that .	is	4	0
206	For an occasional change he adds that most of all he detests his immortality and his incredible fame .	detests	11	0
1071	The Coalition had no proper funds to buy the mills , so theycould do nothing but sit back and watch as the mills closed .	had	2	0
660	What we do , rebelling against the oppression of the many governments that oppose us , we 're going to leave a legacy .” He sounded certain .	sounded	25	0
1060	This prohibited strikes and lockout , angeringworkers and driving productivity and laborer morale down .	prohibited	1	0
763	Tell me ,” I said , after we sat , what you have found .” It was n't a question .	was	16	0
1483	The room held a bed , a bookcase , and a desk with one chair .	held	2	0
380	”Dixon took the step that separated them , and then , very slowly at first to give her all the time she might need to step back and away , put his arms round her .	separated	5	0
1846	What the strag will think is that any man who can hitch the length and breadth of the galaxy , rough it , slum it , struggle against terrible odds , win through , and still knows where his towel is is clearly a man to be reckoned with . '	reckoned	47	0
1328	We slammed against the doorway and I was laughing too , the pulse close enough to shake the doorframe and set up vibrations in my chest , Rachel in my arms because shed used me to soften her landing .	used	33	0
882	First , the " from my cold , dead hands " part : This is used by Moore as a visual citation to introduce Heston .	is	14	0
1279	At short intervals along the moving catwalk , wide transparent tubes led down to floor level .	led	11	0
794	Maybe we 'd never know each other , not truly , because we all hid behind the stories , creating the realities we wanted to see .	know	4	0
524	This was heaven .	was	1	0
431	Here he was waylaid by Caleb , who had a finger buried in the slick leaves of a catalogue .	waylaid	3	0
1520	The next room had mosaics of what could have been Rome , with men in simple tunics working in a vineyard on one wall and men in odd , floppy hats on the other .	had	3	0
1288	Your God person puts an apple tree in the middle of a garden and says do what you like guys , oh , but don t eat the apple .	like	18	0
1381	This person , like me , is not a member of traditional society .	is	6	0
997	That 's because they know all too well that Moore is correct : The United States have a far greater homicide rate ( both gun- and non-gun ) than most other first world countries .	is	10	0
174	As a result of armistice agreements in 1949 , Jerusalem was divided : West Jerusalem was to be under Israeli control , and East Jerusalem ( including the Old City , with its Jewish , Muslim , Christian , and Armenian quarters ) came under Jordanian authority .	was	10	0
583	They all looked the same : clusters of social butterflies surrounded by the less apt , the hangers-on , the circle with whom the gossip was shared .	surrounded	10	0
1794	, many islands had already transferred their allegiance to the victors , who were led by Philip II of Macedon .	led	14	0
292	For , though your accusations were ill-founded , formed on mistaken premises , my behaviour to you at the time had merited the severest reproof .	merited	21	0
829	On your webpage , you state that " Moore 's resolution is questionable .	is	11	0
610	Fact : Some places are timeless .	are	4	0
538	After watching my ship tear apart , after spending a good twenty-three hours floating in silence in the wreck , wondering whether I was currently facing stars belonging to the constellation Libra or the constellation Orion when those stars were viewed from Earth , wondering what it felt like to suffocate , and after the feeling that yes , I was in fact going to die alone in space had sunk in , it took time for that feeling to dissipate .	facing	25	0
1252	The Lalamatine district is one of those very few areas which doesn t enjoy a perpetual Saturday afternoon - it enjoys instead the cool of a perpetual early Saturday evening .	enjoy	13	0
220	You believe the other medicine may have just as much value , but in other situations , not this one .	believe	1	0
5	Around that winding , circling kolo of young bodies tirelessly leaping up and down in the same rhthym , the children played , running in and out between the dancing feet as if through a moving fence , standing in the centre of this kolo which was being danced for the first time in their lives on that bridge about which there had been so much talk for years , and even on the kapia , wherein , it was said , the unlucky Arab was imprisoned and showed himself of nights . "	imprisoned	86	0
975	Had the boy 's mother not been shipped to a " welfare to work " program , she might at least have had some time to spend with her son .	been	6	0
703	How and why this ship exists .	exists	5	0
816	Every ship had life boats .	had	2	0
517	An opportunist and a businessman , that was Jefferson .	was	7	0
323	, 2010 By the time I got to Asheville , I was nearing the end of my journey and the bottom of my wallet .	was	11	0
175	However , with the city partitioned by fortifications and barbed wire , no Israeli or Jewish pilgrims were allowed to visit the Western Wall or other Jewish sites in East Jerusalem .	allowed	18	0
212	Tibetan Buddhist Retreat Faded squares of fabric , strung together in repeating blue-white-red-green-yellow chains , crisscross the branches of bare-limbed trees .	crisscross	15	0
190	The apparent strengths of the forces in any field theory depend on two kinds of numerical parameter : the masses ( if any ) of the particles like W and Z particles that transmit the forces , and certain intrinsic strengths ( also known as coupling constants ) that characterize the likelihood for particles like photons or gluons or Wand Z particles to be emitted and reabsorbed in particle reactions .	characterize	49	0
414	Had Hotblack Desiato been alive , he probably would have deemed this a good moment to lean back , or even go for a short walk .	deemed	10	0
397	Now Théoden son of Thengel , will you hearken to me ? '	hearken	8	0
1706	He jumped at my arm while I was still off-balance , and I felt the surge of adrenaline that comes right when your body realizes that its too late to save itself .	was	7	0
83	He mourned the moral advantages these mistakes had cost him .	mourned	1	0
1310	Rachel and I went out to dinner , and when we finished , she saw that there was a message on her cell phone .	was	17	0
642	No , we 're the start of a rebellion .	're	3	0
1007	" That 's right .	's	2	0
147	Queen Helena , a devout Christian and the mother of Emperor Constantine the Great , made a pilgrimage to the Holy Land in 326 to identify the sites associated with Jesuss life .	associated	28	0
514	So , I 'm on a ship now ?	'm	3	0
923	Concerning the Georgetown Hoya interview where Heston was asked about Rolland , you write : " There is no indication that [Heston] recognized Kayla Rolland 's case . "	is	17	0
61	Inasmuch as a work of literature does not embody reality in a direct sense , but only a reflection and a generalisation of it , it is as a rule concerned not with unique meanings but with specific meanings ;And slowly , " he said pressing onwards , " slowly , slowly slowly , all your excess body fat . . . turns . . . to . . . " he paused for effect , " subcoo . . . subyoo . . . subtoocay . . . " - he paused for breath - " subcutaneous gold , which you can have surgically removed .	embody	8	0
974	But the real cause here are not the drugs themselves , but poverty and the " war on drugs " .	are	5	0
1059	Strikes racked the town during the forties , fifties , and sixties , and they were often long andbloody .	were	15	0
691	Traveling on this ship .” Ray , he looked down at his hands , folded together in his lap , fingers interlaced .	folded	14	0
1046	Mahoning County was a one-industry area , and the people of Youngstown , Struthers , Campbell , Boardman Township , and the numerous other small towns and villages in the area only had one main employer : the steel mills .	had	32	0
1499	If there is any boon that you would have us do in return , we would be glad to do it .”He continued to lie in place , still breathing heavily .	be	16	0
253	The issue of land sales has a long history as a subtheme of the Jewish-Arab struggle .	has	5	0
343	Either way , it 's nice to see a restaurant built on ethics that also happens to be incredibly busy .	's	4	0
1033	Certainly , Moore is one of the most talented filmmakers in the United States today , and his film fully deserved its Oscar .	deserved	20	0
324	The last thing on my mind was spending money : it was beautiful outside , and there were free things to do everywhere .	were	17	0
1674	It looked like he was going to continue , but then he walked out the door .	looked	1	0
1899	You forgot !	forgot	1	0
986	It is notable that the Wall Street Journal 's reaction to this segment of the film was even more dismissive than yours : It called Moore 's claim " preposterous " .	was	16	0
45	It was just as well that her married status put her beyond his ambition , since even their friendship demanded reserves of an attention , of a sort of mental and emotional integrity he was n't sure he really possessed .	possessed	39	0
663	You 've got it all wrong .” He looked from Sarah , to Adrienne , to Zheng , to Kishori and Tiffany , to me .	got	2	0
1646	That sweet , small nose , and her soft lips – shed kiss well , I should think , if gently .	think	17	0
1251	The crowd hadn t the faintest idea what he was talking about , but they loved it nevertheless .	loved	15	0
1546	I mean , what is this place , really ?”He thought about that .	mean	1	0
1008	I could buy as much ammunition as I wanted , in Canada .	wanted	8	0
1726	There was Nepthys , on the other side of the pews , holding the wooden box in his hand .	was	1	0
1244	Ford s technique seemed to consist mainly of standing still for a while and smiling . "	consist	5	0
818	A defense of Michael Moore and " Bowling for Columbine " ( Op-Ed ) By Eloquence Wed Aug 13th , 2003 at 09 :00 :09 AM EST This is an open letter to David Hardy , author of Bowling for Columbine : Documentary or Fiction ?	is	28	0
1509	He took us to the door of a building like a short pagoda that had a sign hanging over it showing a face with hands uplifted , like a saint under G ds light , and handcuffed .	had	14	0
1431	Lets go .” That last one was to me .	was	6	0
532	It took me a couple days to realize I was , in fact , still alive .	took	1	0
54	A man standing on a brightly dressed dais before the building which clearly dominated the square was addressing the crowd over a Tannoy .	dominated	13	0
792	The one thing that was known .	known	5	0
424	His youth and sound nature contended in him against this affliction as against an unhealthy climate .	contended	5	0
332	tupelohoneycafe .com I was convinced but I was n't alone .	was	3	0
779	Well , we 've got the perfect-size group right here .” Just enough for us all to recognize each other .	got	4	0
738	We do n't know how or why he left .	know	3	0
318	The fairest thing you can say about them , then , is that they know what they like , and what they like generally involves hurting people and , wherever possible , getting very angry .	involves	24	0
674	When your life , the reason you lived , the people and faces and places , the emotions you felt , who and what you loved , when all that is gone , faded , what will you have left ?” I wondered how long Ray had been on this ship .	had	46	0
1	Again , tricky to know why this is understood as fighting behaviour .	understood	8	0
499	The recycled air tasted sweet in my mouth , and all thoughts that crossed my mind were cheap metaphors about life-giving substances and how breathing was like sex , only better .	were	16	0
731	Got to be months and months , at least .” You were here before I was ,” said Kishori , and so was Tiffany .” I looked at Zheng ; he shrugged .	was	15	0
652	Me , I followed Adrienne 's example and did n't speak up ( fabricating excuses to myself to stay safely in gather-info observation mode ) , though I thought Zheng had a point .	had	30	0
1497	I do not want to provide help to someone who would do harm .”Sir , we simply want to discover whether this individual is , in fact , a vampire .	want	3	0
906	10 days are more than enough to give advance warning of a change in location or date , had the NRA really wanted to .	had	18	0
204	I 'll vouch for that , " said Fastolfe .	vouch	2	0
760	I did n't want to think about disappearances and time and purposes and consequences .	want	3	0
587	If the barkeep was any indication , I suspected similarly high-class robots fulfilled other positions on the ship .	suspected	8	0
272	A new school of Jewish historians is more critical of the dislocations caused by Jewish land acquisition , and concludes that it was not always fair .	is	6	0
1233	You want to meet the man who rules the Universe .	rules	7	0
1588	The light in the corners of my eyes rushed in , converging on the rosy glow around the stone , and for a moment I was blind .	was	25	0
961	But if they did n't , one of their functions was to continue the racism of the KKK .	was	10	0
1848	So he sat by a window and looked out at a summer lawn and designed and designed and designed , but inevitably got a little distracted by things , and by the time the invaders were practically in orbit round them , had come up with a remarkable new breed of super-fly that could , unaided , figure out how to fly through the open half of a half-open window , and also an off-switch for children .	distracted	25	0
1417	He wasnt a person youd describe with normal adjectives , you know ?”They nodded .	know	11	0
777	I never thought about it .” Adrienne steepled her fingers and studied my face .	thought	2	0
231	A big overlap exists between Tibetan Buddhism , psychology and cognitive science .	exists	3	0
904	10 days are more than enough to give advance warning of a change in location or date , had the NRA really wanted to .	are	2	0
957	Of course the cartoon is highly oversimplified , and most critics consider it one of the weakest parts of the film .	consider	11	0
101	” Scholars speculate that Shalim might have been an ancient Semitic deity of peace , for the name resembles the modern Hebrew and Arabic words for peace” : shalom and salaam , respectively .	been	7	0
1590	There was no sign of the stone .	was	1	0
730	How long have you been here ?” The question , previously posed to me , was presented to the rest of our group ( excluding Ray ; Adrienne had been tactful enough to wait until he had gone for a refill , recalling the last time the subject was broached ) .	been	4	0
1371	Now , will you tell me how you know my family , and how you happened to be driving by just now ?	know	8	0
1159	Dixon felt that this intimacy somehow symbolised and crowned the whole evening .	symbolised	6	0
1494	Now : may we ask you a few questions about an individual we believe to be a vampire ?	be	15	0
858	It is also a licensed firearms dealer which can perform its own background checks .	is	1	0
1486	Frankly , I dont know if we can even doing anything against a vampire .	know	4	0
113	According to biblical tradition , although David bought the land for the Temple and carefully assembled its building materials , he was deemed unworthy of constructing the Temple because he was a man of war with blood on his hands .	deemed	22	0
462	I am the Great Mother . . . and I will warm and soothe you all . . . you will be inside me and feel neither hunger nor fear . . . nor cold . . . I am the Great Mother . . . in me there is warmth , in me alone the sun shines . . . in me you will change , you forlorn little children . . . I am the Great Mother . . . and you , the children of change , Mother will gladden you and you will be children . . . safe and sound . . .We 're going to contrast prostitution as a career choice with prostitution as another word for slavery .	gladden	92	0
1707	On the floor was Dvorovs head , separated from his body by several feet and a growing puddle of dark blood .	was	3	0
1393	I noticed that there were some people on the street , people the same color as the soiled buildings .	were	4	0
1247	D 'Avenat , who deplored having to live in this Bosnian wilderness rather than at an Embassy or in the service of a Vizier in Istanbul , as suited his abilities and the opinion he himself had of them , was the very person to find out and pass on all this information .	deplored	4	0
112	According to biblical tradition , although David bought the land for the Temple and carefully assembled its building materials , he was deemed unworthy of constructing the Temple because he was a man of war with blood on his hands .	was	21	0
1422	I remember that he hardly ever moved , just stared at Rachel .	remember	1	0
1768	Passengers are not allowed on the flight deck . "	allowed	3	0
1319	Come on , I dont have to get fucked up every time we go out just to enjoy myself .	enjoy	17	0
800	She smiled , then crossed the room to join me by the window , not waiting for an answer .	waiting	15	0
824	Not surprisingly , much of the criticism of Moore 's film is misguided or outright wrong , often vastly more inaccurate than Moore 's work itself .	is	11	0
1563	So what else do you want to know , Nathan ?”I dont know …hey , what about the nature spirits , things like that ?	know	7	0
1554	We arent quite what youd expect from reading the Grimms .”What do you mean ?”Okay , take elves .” He caught the bartenders eye for another shot .	expect	5	0
900	They were right .	were	1	0
599	Did it truly matter what the ship 's origin was and why Jefferson had saved me , if now , I was content ?	matter	3	0
